{
  "avatar_id": "7c9e6679-7425-40de-944b-e07fc1f90004",
  "spec": {
    "avatar_id": "7c9e6679-7425-40de-944b-e07fc1f90004",
    "age_band": "teenager",
    "presentation": "feminine",
    "skin_tone": "brown",
    "hair": {
      "length": "long",
      "colour": "black",
      "texture": "straight",
      "style": "natural"
    },
    "attire": "sportswear",
    "background": "neutral_white",
    "pose": "slight_tilt_up",
    "seed": 505,
    "negative_controls": [
      "blurry",
      "watermark",
      "nsfw",
      "deformed",
      "low_quality"
    ],
    "aspect_ratio": "1:1",
    "resolution_hint": 512,
    "reference_images": [],
    "consent_token": null,
    "model_override": null,
    "extra_prompt_tokens": [],
    "metadata": {}
  },
  "seed": 505,
  "model": "stabilityai/stable-diffusion-v1-5",
  "model_revision": "v1.0",
  "checkpoint": null,
  "prompt_generated": "feminine-presenting person, teenager, approximately 16 years old, brown skin tone, long hair, black straight hair, natural, wearing athletic sportswear, neutral white background, slightly tilted upward gaze, photorealistic portrait, high detail, sharp focus, professional photography, 8k resolution, cinematic lighting",
  "negative_prompt": "blurry, watermark, text overlay, logo, signature, deformed anatomy, extra limbs, fused fingers, bad hands, ugly, low quality, disfigured, nsfw, nude, violent, offensive content, cartoon, anime, painting, illustration, 3d render, cgi, deformed, low_quality",
  "provenance": {
    "pipeline_version": "1.0.0",
    "generated_at": "2026-09-11T12:44:10.814372+00:00",
    "compute_route": "free_ai",
    "runtime_sec": 23.807,
    "steps": 30,
    "guidance_scale": 7.5
  },
  "safety": {
    "passed": true,
    "checks": [
      "dimension_check(OK: 512x512)",
      "blank_check(OK: variance=5722.00)",
      "nsfw_heuristic(OK: score=0.304)",
      "watermark_absent(OK: corner_contrast=254)"
    ],
    "flags": [],
    "score": 0.30391693115234375
  },
  "dimensions": {
    "width": 512,
    "height": 512,
    "aspect_ratio": "1:1"
  },
  "orthogonality_scores": null,
  "watermark": {
    "algorithm": "dwtDct",
    "payload_bits": 64,
    "payload_hex": "69a1996164d76cf5",
    "ber_self_check": 0.3281,
    "survives_jpeg_q70": false,
    "embedded": true
  },
  "consent_chain": null,
  "rung_progression": null,
  "compute_saved_pct": null,
  "output_files": {
    "image": "C:\\TSVV\\INCUBRIX\\SOFTWARE\\avatar-gen\\jobs\\job_006\\avatar_7c9e6679.png",
    "spec_delta": "C:\\TSVV\\INCUBRIX\\SOFTWARE\\avatar-gen\\jobs\\job_006\\spec_delta.json",
    "failure_record": null
  }
}