{
  "avatar_id": "7c9e6679-7425-40de-944b-e07fc1f90003",
  "spec": {
    "avatar_id": "7c9e6679-7425-40de-944b-e07fc1f90003",
    "age_band": "senior",
    "presentation": "feminine",
    "skin_tone": "warm_medium",
    "hair": {
      "length": "long",
      "colour": "white",
      "texture": "straight",
      "style": "natural"
    },
    "attire": "winter_coat",
    "background": "studio_lit",
    "pose": "front_facing",
    "seed": 404,
    "negative_controls": [
      "blurry",
      "watermark",
      "nsfw",
      "deformed",
      "low_quality"
    ],
    "aspect_ratio": "1:1",
    "resolution_hint": 512,
    "reference_images": [],
    "consent_token": null,
    "model_override": null,
    "extra_prompt_tokens": [],
    "metadata": {}
  },
  "seed": 404,
  "model": "stabilityai/stable-diffusion-v1-5",
  "model_revision": "v1.0",
  "checkpoint": null,
  "prompt_generated": "feminine-presenting person, senior adult, approximately 65 years old, warm medium skin tone, long hair, white straight hair, natural, wearing a winter coat, professional studio lighting background, facing directly forward, portrait orientation, photorealistic portrait, high detail, sharp focus, professional photography, 8k resolution, cinematic lighting",
  "negative_prompt": "blurry, watermark, text overlay, logo, signature, deformed anatomy, extra limbs, fused fingers, bad hands, ugly, low quality, disfigured, nsfw, nude, violent, offensive content, cartoon, anime, painting, illustration, 3d render, cgi, deformed, low_quality",
  "provenance": {
    "pipeline_version": "1.0.0",
    "generated_at": "2026-09-11T12:43:20.455381+00:00",
    "compute_route": "free_ai",
    "runtime_sec": 5.746,
    "steps": 30,
    "guidance_scale": 7.5
  },
  "safety": {
    "passed": true,
    "checks": [
      "dimension_check(OK: 512x512)",
      "blank_check(OK: variance=1771.63)",
      "nsfw_heuristic(OK: score=0.300)",
      "watermark_absent(OK: corner_contrast=254)"
    ],
    "flags": [],
    "score": 0.30042375837053575
  },
  "dimensions": {
    "width": 512,
    "height": 512,
    "aspect_ratio": "1:1"
  },
  "orthogonality_scores": null,
  "watermark": {
    "algorithm": "dwtDct",
    "payload_bits": 64,
    "payload_hex": "4832732b64d76cf5",
    "ber_self_check": 0.3594,
    "survives_jpeg_q70": false,
    "embedded": true
  },
  "consent_chain": null,
  "rung_progression": null,
  "compute_saved_pct": null,
  "output_files": {
    "image": "C:\\TSVV\\INCUBRIX\\SOFTWARE\\avatar-gen\\jobs\\job_005\\avatar_7c9e6679.png",
    "spec_delta": "C:\\TSVV\\INCUBRIX\\SOFTWARE\\avatar-gen\\jobs\\job_005\\spec_delta.json",
    "failure_record": null
  }
}